{"actor":"agent","conversation_id":"0192f3a0c1d27e4fb6a8","decision":"user-allow","deployment_before":"sha256:9b1f0c3e5a7d2e4f6a8b0c1d3e5f7a9b1c3d5e7f9a0b2c4d6e8f0a1b3c5d7e9f","event_id":"019811a2-7c3e-7d10-9b8a-3f2e1d0c4b5a","input_redacted":{"command":"rpm-ostree install htop"},"result":"ok","snapshot_ref":"famulus-snap/019811a2-7c3e-7d10-9b8a-3f2e1d0c4b5a/etc+var@1751884800","tier":2,"tool":"Bash"}
