{"actor":"agent","conversation_id":"0192f3a0c1d27e4fb6a8","decision":"auto-allow","deployment_before":null,"event_id":"019f3ce3-fc82-7a1c-8f3b-1d2e4a6c8b0f","input_redacted":{"uri":"file:///home/user/Pictures/aurora.png"},"result":"ok","snapshot_ref":null,"tier":0,"tool":"mcp__famulus_desktop__wallpaper_set"}
